"","author.ID","paper.ID","coauthor.names","paper.title","journal.title","author.names"
"337","8","23","D Johnson, D Johnson","Origins of the Equivalent Circuit Concept: The Current-Source Equivalent ","Proc IEEE","D Johnson"
"338","8","24","D Johnson, D Johnson","Origins of the Equivalent Circuit Concept: The Voltage-Source Equivalent ","Proc IEEE","D Johnson"
"339","8","25","D Johnson, D Johnson","Signal Encoding in the Firing Patterns of Auditory Neurons,","Invited talk IMA Journal of Applied Mathematics Workshop Audition","D Johnson"
"340","8","1","D Johnson, A Dabak, D Johnson","Relations between Kullback-Leibler distance and Fisher information ","NA","D Johnson"
"341","8","26","D Johnson, O Kelly, D Johnson, B Delgutte, B Delgutte, P Cariani","Fractal noise strength in auditory-nerve fiber recordings ","J Acoust Soc Am","D Johnson"
"342","8","2","D Johnson, I Goodman, D Johnson","New multivariate dependence measures and applications to neural ensembles ","Workshop Statistical Signal Processing","D Johnson"
"343","8","3","C Gruner","Comparison of optimal and suboptimal spike sorting algorithms to theoretical limits ","Neurocomputing","D Johnson"
"344","8","27","D Johnson, C Leang, D Johnson","On the asymptotics of M-hypothesis Bayesian detection ","IEEE Trans Info Th","D Johnson"
"345","8","4","C Gruner","Correlation and neural information coding fidelity and efficiency ","Neurocomputing","D Johnson"
"346","8","28","D Johnson, M Lexa, D Johnson","Information processing of linear block decoders ","NA","D Johnson"
"347","8","5","D Johnson, C Gruner, D Johnson","Correlation; neural information coding fidelity ; efficiency ","Neurocomputing","D Johnson"
"348","8","29","D Johnson, A Lexa, D Johnson","An information processing approach to distributed detection ","Workshop Statistical Signal Processing","D Johnson"
"349","8","6","C Gruner, R Glantz","Quantifying information transfer in spike generation ","Neurocomputing","D Johnson"
"350","8","7","D Johnson, D Johnson, J Wise, NA ","A different first course in electrical engineering ","Signal Processing Magazine","D Johnson"
"351","8","8","D Johnson, D Johnson, C Gruner, NA , R Glantz","Quantifying information transfer in spike generation ","Neurocomputing","D Johnson"
"352","8","9","D Johnson, D Johnson, C Gruner, K Baggerly, K Baggerly, C Seshagiri","Information-theoretic analysis of neural coding ","J Computational Neuroscience","D Johnson"
"353","8","30","D Johnson, A Lexa, D Johnson","A new look at the informational gain of soft decisions ","ICASSP","D Johnson"
"354","8","31","D Johnson, A Lexa, D Johnson","Optimizing binary decision systems by manipulating transmission intervals ","NA","D Johnson"
"355","8","32","D Johnson, C Miller, D Johnson, J Schroeter, L Myint, R Glantz","Visual responses of crayfish ocular motoneurons: An information theoretical analysis ","J Computational Neuroscience","D Johnson"
"356","8","33","D Johnson, C Miller, D Johnson, J Schroeter, L Myint, L Myint, R Glantz","Visual signal in an optomotor reflex: Systems ; information theoretic analysis ","J Computational Neuroscience","D Johnson"
"357","8","34","C Miller, J Schroeter, L Myint, R Glantz","Visual Signals in an Optomotor Reflex: Systems and Information Theoretic Analysis ","Journal of Computational Neuroscience","D Johnson"
"358","8","35","D Johnson, C Rozell, D Johnson","Information processing during transient responses in the crayfish visual system ","NA","D Johnson"
"359","8","36","C Seshagiri, C Gruner, K Baggerly","Information-Theoretic Analysis of Neural Coding ","Journal of Computational Neuroscience","D Johnson"
"360","8","37","D Johnson, S Sinanovic, D Johnson","Toward a theory of information processing ","International Symposium Information Theory","D Johnson"
"361","8","38","D Johnson, W Wang, D Johnson","Linear transforms of symbolic data ","IEEE Trans Signal Processing","D Johnson"
"362","8","39","D Johnson, L Yue, D Johnson","Optimal binaural processing based on point process models of preprocessed cues ","J Acoust Soc Am","D Johnson"
"363","8","40","D Johnson, M Zacksenhouse, D Johnson, J Williams, J Williams, C Tsuchitani","Single-neuron modeling of LSO unit responses ","J Neurophysiol","D Johnson"
"364","9","1","J Brodman","What Small Business and Small Organizations Say About the CMM: Experience Report ","ICSE International Conference Software Engineering","D Johnson"
"365","9","2","J Brodman","A Software Process Improvement Approach Tailored for Small Organizations and Small Projects Tutorial ","ICSE International Conference Software Engineering","D Johnson"
"366","9","3","J Brodman","Return on Investment ROI from Software Process Improvement as Measured by US Industry ","Software Process Improvement and Practice","D Johnson"
"367","9","4","J Brodman","Applying CMM Project Planning Practices to Diverse Environments ","IEEE Software","D Johnson"
"368","9","5","J Brodman","Realities and Rewards of Software Process Improvement ","IEEE Software","D Johnson"
