"","author.ID","paper.ID","coauthor.names","paper.title","journal.title","author.names"
"1","10","1","E Rundensteiner, H Kuno, P Jos&eacute, M Marr&oacute, n n, V Crestana-Taube, Y Ra","The MultiView Project: Object-Oriented View Technology and Applications ","SIGMOD International Conference Management of Data Conference","M Jones"
"2","10","2","E Rundensteiner, Y Huang","Symbolic Intersect Detection: A Method for Improving Spatial Intersect Joins ","GeoInformatica","M Jones"
"3","10","3","E Rundensteiner, Y Huang","Improving Spatial Intersect Joins Using Symbolic Intersect Detection ","SSD Symposium Large Spatial Databases","M Jones"
"4","10","4","E Rundensteiner","View Materialization Techniques for Complex Hierarchical Objects ","CIKM International Conference Information and Knowledge Management","M Jones"
"5","11","1","C Berkley, D Metacat, J Bojilova","a Schema-Independent XML Database System ","SSDBM Statistical and Scientific Database Management","M Jones"
"6","11","2","C Berkley, D Metacat","Managing Heterogeneous Ecological Data Using Morpho ","SSDBM Statistical and Scientific Database Management","M Jones"
"7","11","3","C Berkley, J Bojilova, M Schildhauer","Managing Scientific Metadata ","IEEE Internet Computing","M Jones"
"8","12","1","S Kang","Appearance-Based Structure from Motion Using Linear Classes of -D Models ","International Journal of Computer Vision","M Jones"
"9","12","2","C Procopiuc, P Agarwal, T Murali","A Monte Carlo algorithm for fast projective clustering ","SIGMOD International Conference Management of Data Conference","M Jones"
"10","13","1","","Towards GHDL","NA","M Jones"
"11","13","2","M Jones, P Black, K Hall, M Jones, T Larson, P Windley","A Brief Introduction to Formal Methods"," IEEE Custon Integrated Circuits Conference","M Jones"
"12","13","3","M Jones, A Bunker, M Jones, T Larson, P Windley","Alexandria: Libraries of Abstract, Verified Hardware Modules"," Workshop Libraries Component Modeling and Quality Assurance","M Jones"
"13","13","4","A Bunker, T Larson, P Windley","Alexandria: A Tool for Heirarchical Verification"," Tools Paper FMCAD LNCS edited by Windley and Gopalakrishnan","M Jones"
"14","13","5","G Gopalakrishnan","Verifying Transaction Ordering Properties in Unbounded Bus Networks through Combined Deductive/Algorithmic Methods ","FMCAD Formal Methods Computer Aided Design","M Jones"
"15","13","6","M Jones, M Jones, G Gopalakrishnan","Verifying Transaction ordering properties in Unbounded Bus Networks through Combined Deductive/Algorithmic Methods,","Formal Methods Computer Aided Design FMCAD Formal Methods Computer Aided Design Springer LNCS v","M Jones"
"16","13","7","M Jones, A Jones, M Jones, M Clement, Q Snell","Pyramid Broadcasting with Fast-forward and Rewind"," th International Conference Telecommunication Systems Modelling and Analysis Nashville","M Jones"
"17","13","8","M Jones, M Jones","Restricted Types for HOL"," Category B of TPHOLs","M Jones"
"18","13","9","M Jones, M Jones, G Gopalakrishnan","Toward Automated Abstraction for Protocols over Branching Networks"," IEEE International High Level Design Validation and Test Workshop HLDVT","M Jones"
"19","13","10","M Jones, A Mokkedem, R Hosabettu, M Jones, G Gopalakrishnan","Formalization and Proof of a Solution to the {PCI} Bus Transaction Ordering Problem"," Formal Methods Systems Design","M Jones"
"20","13","11","A Weinzoepflen, D Cansell, D M&eacute, r ry, G Gopalakrishnan","Incremental Proof of the Producer/Consumer Property for the PCI Protocol ","ZB","M Jones"
"21","1","32","M Jones, M Jones","Simplifying and Improving Qualified Types,","Research Report YALEU DCS RR Yale University New Haven Shorter revised version without proofs appears FPCA Functional Programming Languages and Computer Architecture Conference Functional Programming Languages and Computer Architecture Jolla Computer Animation","M Jones"
"22","1","16","A Black, J Nordlander, M Carlsson, R Kieburtz","Reactive Objects ","Symposium Object Oriented Real Time Distributed Computing","M Jones"
"23","1","33","M Jones, M Jones","Using Parameterized Signatures to Express Modular Structure,","Proceedings of the Twenty Third Annual ACM SIGPLAN Special Interest Group Programming Languages SIGACT Symposium Principles of Programming Languages St Beach","M Jones"
"24","1","17","M Jones, B Gaster, M Jones","A Polymorphic Type System for Extensible Records and Variants,","Technical report NOTTCS TR Department of Computer Science University of Nottingham University Park Nottingham NG RD England","M Jones"
"25","1","34","M Jones, M Jones, P Hudak, S Shaumyan","Using Types to Parse Natural Language,","Proceedings of the Workshop Functional Programming Ullapool Scotland To be published the Springer Verlag Workshops Computer Science Series","M Jones"
"26","1","18","P Hudak, S Liang","Monad Transformers and Modular Interpreters ","POPL Symposium Principles of Programming Languages","M Jones"
"27","1","35","M Jones, M Jones","A system of constructor classes: overloading and implicit higher-order polymorphism,","FPCA Functional Programming Languages and Computer Architecture Conference Functional Programming Languages and Computer Architecture Copenhagen Appears extended form the Journal of Functional Programming University Press","M Jones"
"28","1","19","P Hudak, S Shaumyan","Using Types to Parse Natural Language ","Functional Programming","M Jones"
"29","1","36","M Jones, M Jones","The implementation of the Gofer functional programming system,","Research Report YALEU DCS RR Yale University New Haven","M Jones"
"30","1","37","M Jones, M Jones","A theory of qualified types,","ESOP European Symposium Programming European Symposium Programming Rennes Springer Verlag Lecture Notes Computer Science","M Jones"
"31","1","38","S Jones, E Meijer","Type classes: exploring the design space,","Proceedings of the Haskell Workshop The th","M Jones"
"32","1","39","M Jones, M Jones","Type Classes with Functional Dependencies,","Proceedings of the th European Symposium Programming ESOP European Symposium Programming Springer Verlag LNCS","M Jones"
"33","1","1","","Computing with Lattices: An Application of Type Classes ","Journal of Functional Programming","M Jones"
"34","1","2","","Dictionary-Free Overloading by Partial Evaluation ","Lisp and Symbolic Computation","M Jones"
"35","1","3","","Dictionary-Free Overloading by Partial Evaluation ","PEPM Partial Evaluation and Semantic Based Program Manipulation","M Jones"
"36","1","4","","Functional Programming with Overloading and Higher-Order Polymorphism ","Advanced Functional Programming","M Jones"
"37","1","5","","First-class Polymorphism with Type Inference ","POPL Symposium Principles of Programming Languages","M Jones"
"38","1","6","","ML Typing, Explicit Polymorphism and Qualified Types ","TACS Theoretical Aspects of Computer Software","M Jones"
"39","1","7","","Integrating Programming, Properties, and Validation ","MPC Mathematics of Program Construction","M Jones"
"40","1","8","","Programming with Constructor Classes Abstract ","PLILP Symposium Programming Language Implementation and Logic Programming","M Jones"
"41","1","9","","Programming with Constructor Classes Preliminary Summary ","Functional Programming","M Jones"
"42","1","20","M Jones, M Jones","Coherence for qualified types,","Research Report YALEU DCS RR Yale University New Haven","M Jones"
"43","1","21","M Jones, M Jones, L Duponcheel","Composing Monads,","Research Report YALEU DCS RR Yale University New Haven","M Jones"
"44","1","22","M Jones, M Jones","Computing with lattices: An application of type classes","Journal of Functional Programming University Press","M Jones"
"45","1","23","M Jones, M Jones","Dictionary-free Overloading by Partial Evaluation,","ACM SIGPLAN Special Interest Group Programming Languages Workshop Partial Evaluation and Semantics Based Program Manipulation","M Jones"
"46","1","40","M Jones, M Jones","Typing Haskell in Haskell,","Proceedings of the Haskell Workshop Published Technical Report UU CS Department of Computer Science University of Utrecht","M Jones"
"47","1","24","M Jones, M Jones","Functional Programming with Overloading and Higher-Order Polymorphism","First International School Advanced Functional Programming Techniques B aa stad Springer Verlag Lecture Notes Computer Science","M Jones"
"48","1","41","M Jones, M Jones","The Functions of Java Bytecode,","Proceedings of the OOPSLA Conference Object Oriented Programming Systems Languages and Applications workshop Formal Underpinnings of Java","M Jones"
"49","1","25","M Jones, M Jones","From Hindley-Milner Types to First-Class Structures,","Proceedings of the Haskell Workshop Jolla Yale University Research Report YALEU DCS RR","M Jones"
"50","1","42","M Jones, S Liang, P Hudak, M Jones","Monad Transformers and Modular Interpreters,","Conference Record of POPL Symposium Principles of Programming Languages ACM SIGPLAN Special Interest Group Programming Languages SIGACT Symposium Principles of Programming Languages San Francisco Computer Animation","M Jones"
"51","1","26","M Jones, M Jones","First-class Polymorphism with Type Inference,","Proceedings of the Twenty Fourth Annual ACM SIGPLAN Special Interest Group Programming Languages SIGACT Symposium Principles of Programming Languages","M Jones"
"52","1","43","J Peterson","Implementing Type Classes ","PLDI Special Interest Group Programming Language Design and Implementation","M Jones"
"53","1","27","M Jones, M Jones","Hugs , The Haskell User's Gofer System: User Manual,","Technical Report NOTTCS TR Functional Programming Research Group Department of Computer Science University of Nottingham Nottingham NG RD England","M Jones"
"54","1","44","M Jones, J Peterson, M Jones","Implementing Type Classes,","Proceedings of ACM SIGPLAN Special Interest Group Programming Languages Symposium Programming Language Design and Implementation ACM SIGPLAN Special Interest Group Programming Languages","M Jones"
"55","1","28","M Jones, M Jones, S Jones","Lightweight Extensible Records for Haskell,","Proceedings of the Haskell Workshop Published Technical Report UU CS Department of Computer Science University of Utrecht","M Jones"
"56","1","29","M Jones, M Jones","Qualified Types: Theory and Practice,","University Press","M Jones"
"57","1","10","","Simplifying and Improving Qualified Types ","FPCA Functional Programming Languages and Computer Architecture","M Jones"
"58","1","11","","Using Parameterized Signatures to Express Modular Structure ","POPL Symposium Principles of Programming Languages","M Jones"
"59","1","12","","A System of Constructor Classes: Overloading and Implicit Higher-Order Polymorphism ","FPCA Functional Programming Languages and Computer Architecture","M Jones"
"60","1","13","","A Theory of Qualified Types ","Sci Comput Program","M Jones"
"61","1","14","","A Theory of Qualified Types ","ESOP European Symposium Programming","M Jones"
"62","1","30","M Jones, M Jones","ML typing, explicit polymorphism and qualified types","TACS Theoretical Aspects of Computer Software Conference theoretical aspects of computer software Sendai Springer Verlag Lecture Notes Computer Science","M Jones"
"63","1","15","","Type Classes with Functional Dependencies ","ESOP European Symposium Programming","M Jones"
"64","1","31","M Jones, M Jones, P Hudak","Implicit and explicit parallel programming in Haskell","Research Report YALEU DCS RR Yale University New Haven","M Jones"
"65","2","12","C Fraser, R Draves, R Rashid, R Fitzgerald, T Knoblock, W Bolosky","Operating System Directions for the Next Millennium ","Workshop Hot Topics Operating Systems","M Jones"
"66","2","13","M Jones, M Jones, D Rosu, M Rosu","CPU Reservations and Time Constraints: Efficient, Predictable Scheduling of Independent Activities ","Proceedings of the th ACM Symposium Operating Systems Principles Saint Malo pages","M Jones"
"67","2","30","P Leach, R Draves","Support for User-Centric Modular Real-Time Resource Management in the Rialto Operating System ","NOSSDAV Network and Operating System Support for Digital Audio and Video","M Jones"
"68","2","14","M Jones, M Jones, J Regehr","CPU Reservations and Time Constraints: Implementation Experience on Windows NT ","Proceedings of the Third USENIX the Advanced Computing Systems Association Windows Symposium pages","M Jones"
"69","2","31","A Mok, C Locke, C Heitmeyer, K Jeffay, R Rajkumar","Future Distributed Embedded and Real-Time Applications Will Be Adaptive: Meanings, Challenges and Research Paradigms Panel ","ICDCS International Conference Distributed Computing Systems","M Jones"
"70","2","15","M Jones, M Jones, P Leach, R Draves, J Barrera, I III","Modular Real-Time Resource Management in the Rialto Operating System ","Proceedings of the Fifth Workshop Hot Topics Operating Systems HotOS V Orcas Island pages IEEE Computer Society","M Jones"
"71","2","32","R Rashid","Mach and Matchmaker: Kernel and Language Support for Object-Oriented Distributed Systems ","OOPSLA Conference Object Oriented Programming Systems Languages and Applications","M Jones"
"72","2","16","M Jones, M Jones, J III, A Forin, P Leach, D Rosu, M Rosu","An Overview of the Rialto Real-Time Architecture ","Proceedings of the Seventh ACM SIGOPS European Workshop Connemara pages","M Jones"
"73","2","33","M Jones, J Regehr, M Jones, J Stankovic","Operating System Support for Multimedia: The Programming Model Matters ","Microsoft Research Technical Report MSR TR","M Jones"
"74","2","17","M Jones, M Jones, J Regehr","Predictable Scheduling for Digital Audio ","Microsoft Research Technical Report MSR TR","M Jones"
"75","2","34","J Regehr","The Problems You're Having May Not Be the Problems You Think You're Having: Results from a Latency Study of Windows NT ","IEEE Real Time Technology and Applications Symposium","M Jones"
"76","2","18","M Jones, M Jones, S Saroiu","Predictable Scheduling for a Soft Modem ","Microsoft Research Technical Report MSR TR","M Jones"
"77","2","35","J Regehr","The Problems You're Having May Not Be the Problems You Think You're Having: Results from a Latency Study of Windows NT ","Workshop Hot Topics Operating Systems","M Jones"
"78","2","19","M Jones, M Jones, S Saroiu","Predictability Requirements of a Soft Modem ","Proceedings of the ACM SIGMETRICS Measurement and Modeling of Computer Systems Conference Measurement and Modeling of Computer Systems","M Jones"
"79","2","36","J Regehr, S Saroiu","Two Case Studies in Predictable Application Scheduling Using Rialto/NT ","IEEE Real Time Technology and Applications Symposium","M Jones"
"80","2","37","D Rosu, M Rosu","CPU Reservations and Time Constraints: Efficient, Predictable Scheduling of Independent Activities ","SOSP Symposium Operating Systems Principles","M Jones"
"81","2","38","S Saroiu","Predictability requirements of a soft modem ","SIGMETRICS Measurement and Modeling of Computer Systems Performance","M Jones"
"82","2","39","M Jones, M Theimer, M Jones","Overlook: Scalable Name Service on an Overlay Network ","Proceedings of the International Conference Distributed Computing Systems ICDCS International Conference Distributed Computing Systems IEEE Computer Society","M Jones"
"83","2","20","M Jones, M Jones, J Regehr","Issues in Using Commodity Operating Systems for Time-Dependent Tasks: Experiences from a Study of Windows NT ","Proceedings of the Eighth International Workshop Network and Operating Systems Support for Digital Audio and Video NOSSDAV Network and Operating System Support for Digital Audio and Video England","M Jones"
"84","2","21","M Jones, M Jones, J Regehr","The Problems You're Having May Not Be the Problems You Think You're Having: Results from a Latency Study of Windows NT ","Proceedings of the Seventh Workshop Hot Topics Operating Systems HotOS VII Rio Rico IEEE Computer Society","M Jones"
"85","2","22","M Jones, M Jones, J Regehr, S Saroiu","Two Case Studies in Predictable Application Scheduling Using Rialto/NT ","Proceedings of the Seventh Real Time Technology and Applications Symposium RTAS IEEE Real Time Technology and Applications Symposium Taipei","M Jones"
"86","2","23","M Jones, M Jones","Bringing the C Libraries With Us into a Multi-Threaded Future ","Proceedings of the Winter Usenix Conference pages","M Jones"
"87","2","40","M Thompson, R Rashid","Matchmaker: An Interface Specification Language for Distributed Processing ","POPL Symposium Principles of Programming Languages","M Jones"
"88","2","24","M Jones, M Jones","Consumer Real-Time Systems and Applications ","Invited position statement Distributed Systems Online Real Time and Embedded Systems area special issue Where is Real Time and Embedded Systems Research Going issue IEEE","M Jones"
"89","2","41","A Wolman, A Kermarrec, A Rowstron, H Wang, M Theimer, M Castro","An Evaluation of Scalable Application-Level Multicast Built Using Peer-To-Peer Overlays ","INFOCOM The Conference Computer Communications","M Jones"
"90","2","25","M Jones, M Jones","Adaptive Real-Time Resource Management Supporting Composition of Independently Authored Time-Critical Services ","Proceedings of the Fourth Workshop Workstation Operating Systems WWOS Workshop Workstation Operating Systems now HotOS IV Computer Animation pages IEEE Computer Society","M Jones"
"91","2","42","A Wolman, M Theimer, N Harvey, S Saroiu","SkipNet: A Scalable Overlay Network with Practical Locality Properties ","USENIX the Advanced Computing Systems Association Symposium Internet Technologies and Systems","M Jones"
"92","2","26","M Jones, M Jones","Inheritance in Unlikely Places: Using Objects to Build Derived Implementations of Flat Interfaces ","Proceedings of the Second International Workshop Object Orientation Operating Systems IWOOOS pages IEEE Computer Society","M Jones"
"93","2","27","M Jones, M Jones","Interposition Agents: Transparently Interposing User Code at the System Interface ","Proceedings of the th ACM Symposium Operating Systems Principles ICSC Symposium Neural Computation pages","M Jones"
"94","2","28","M Jones, M Jones","The Microsoft Interactive TV System: An Experience Report ","Microsoft Research Technical Report MSR TR","M Jones"
"95","2","29","M Jones, M Jones","Transparently Interposing User Code at the System Interface ","Ph D thesis Carnegie Mellon University School of Computer Science Available Technical Report CMU CS","M Jones"
"96","2","1","","Consumer Real-Time Systems ","ACM Comput Surv","M Jones"
"97","2","2","","Adaptive Real-Time Resource Management Supporting Composition of Independently Authored Time-Critical Services ","Workshop Workstation Operating Systems","M Jones"
"98","2","3","","Adaptive Real-Time Resource Management Supporting Modular Composition of Digital Multimedia Services ","NOSSDAV Network and Operating System Support for Digital Audio and Video","M Jones"
"99","2","4","","Interposition Agents: Transparently Interposing User Code at the System Interface ","SOSP Symposium Operating Systems Principles","M Jones"
"100","2","5","","Interposition Agents: Transparently Interposing User Code at the System Interface ","Secure Internet Programming","M Jones"
"101","2","6","","A Toolkit for Interposing User Code at the System Interface Abstract ","Operating Systems Review","M Jones"
"102","2","7","A Birrell, E Wobber","A Simple and Efficient Implementation for Small Databases ","SOSP Symposium Operating Systems Principles","M Jones"
"103","2","8","M Jones, W Bolosky, R Draves, R Fitzgerald, C Fraser, M Jones, T Knoblock, R Rashid","Operating System Directions for the Next Millennium ","Proceedings of the Sixth Workshop Hot Topics Operating Systems HotOS Cape Cod IEEE Computer Society","M Jones"
"104","2","9","M Jones, W Bolosky, J Barrera, I III, R Draves, R Fitzgerald, G Gibson, M Jones, S Levi, N Myhrvold, R Rashid","The Tiger Video Fileserver ","Proceedings of the Sixth International Workshop Network and Operating System Support for Digital Audio and Video NOSSDAV Network and Operating System Support for Digital Audio and Video Zushi IEEE Computer Society","M Jones"
"105","2","10","M Jones, L Cabrera, M Jones, M Theimer","Herald: Achieving a Global Event Notification Service ","Proceedings of the Eighth Workshop Hot Topics Operating Systems HotOS VIII Elmau IEEE Computer Society","M Jones"
"106","2","11","M Jones, G Candea, M Jones","Vassal: Loadable Scheduler Support for Multi-Policy Scheduling ","Proceedings of the Second USENIX the Advanced Computing Systems Association Windows Symposium pages Given best student paper award","M Jones"
"107","3","10","J Hess, D Lee, S Harper, P Athanas","Proceedings of IEEE Symposium on Field-Programmalbe Custom Computing Machines, Napa, CA, April, ","NA","M Jones"
"108","3","11","D Lee, P Athanas, S Midkiff","Towards Active Hardware ","IWAN International Working Conference Active Networks","M Jones"
"109","3","12","D Lehn, K Puttehowda, J Park, P Athanas","Evaluation of Rapid Context Switching on a CSRC Device,,","ERSA","M Jones"
"110","3","13","T Martin, Z Nakad","Communications in Electronic Textile Systems ","Communications Computing","M Jones"
"111","3","30","P Plassmann","Solution of Large, Sparse Systems of Linear Equations in Massively Parallel Applications ","Supercomputing","M Jones"
"112","3","14","T Martin, Z Nakad","A Service Backplane for e-Textiles,","MAMSET Proc Workshop Modeling Analysis and Middleware Support for Electronic Textiles","M Jones"
"113","3","31","L Scharf, J Scott, C Twaddle, M Yaconis, K Yao, P Athanas, B Schott","``Implementing an API for Distributed Adaptive Computing Systems,''","Proceedings of IEEE Symposium Field Programmable Custom Computing Machines Computer Animation","M Jones"
"114","3","15","S Mehrotra, J Park","Tasking Distributed Sensor Networks,","Int J of Supercomputer Applications","M Jones"
"115","3","32","D Szyld","``Two-stage Multisplitting Methods with Overlapping Blocks,''","Numerical Linear Algebra with Applications v","M Jones"
"116","3","16","J Park, M Nandwani, P Plassmann, Y Yi","Examining the Communication Requirements of Remote Scientific Visualization ","Communications Computing","M Jones"
"117","3","33","M Tang, P Plassmann, T Canfield","Modeling Piezoelectric Crystals on the Intel Delta ","PPSC SIAM Conference Parallel Processing for Scientific Computing","M Jones"
"118","3","17","J Park, P Plassmann, Y Yi","The Use of Configurable Computing in Scientific Simulations ","PDPTA Parallel and Distributed Processing Techniques and Applications","M Jones"
"119","3","18","M Patrick","``Factoring Indefinite Matrices on High-Performance Architectures,''","SIAM Society for Industrial and Applied Mathematics Journal Matrix Analysis and Applications v","M Jones"
"120","3","19","M Patrick","Vector and Parallel-Vector Implementations of Lanczo's Method for the Generalized Eigenvalue Problem ","PPSC SIAM Conference Parallel Processing for Scientific Computing","M Jones"
"121","3","1","I -, NA ","","NA","M Jones"
"122","3","2","W Barry, P Plassmann","``Parallel Adaptive Mesh Refinement Techniques for Plasticity Problems,''","Advances Engineering Software","M Jones"
"123","3","3","E Coupey","A Script-Based Approach for E-Commerce Applications,","Quarterly Journal of Electronic","M Jones"
"124","3","4","J Edmison, T Martin, Z Nakad","Using Piezoelectric Materials for Wearable Electronic Textile ","ISWC International Symposium Wearable Computers","M Jones"
"125","3","5","J Edmison, Z Nakad, T Martin"," Using piezoelectric materials for wearable electronic textiles, ","Wearable Computers","M Jones"
"126","3","6","L Freitag, P Plassmann","A Parallel Algorithm for Mesh Smoothing ","PPSC SIAM Conference Parallel Processing for Scientific Computing","M Jones"
"127","3","7","L Freitag, P Plassmann","``A Parallel Algorithm for Mesh Smoothing,''","SIAM Society for Industrial and Applied Mathematics Journal Scientific Computing","M Jones"
"128","3","8","L Freitag, P Plassmann","``The Scalability of Mesh Improvement Algorithms,''","IMA Journal of Applied Mathematics Volumes Mathematics and its Applications v","M Jones"
"129","3","9","R Gjertsen, P Plassmann","``Parallel Heuristics for Improved, Balanced Graph Colorings,''","Journal of Parallel and Distributed Computing v","M Jones"
"130","3","20","P Plassmann","``Computational Results for Parallel Unstructured Mesh Computations''","Computing Systems Engineering v","M Jones"
"131","3","21","P Plassmann","``Adaptive Refinement of Unstructured Finite-Element Meshes,''","Journal of Finite Elements Analysis and Design v","M Jones"
"132","3","22","P Plassmann","``Algorithm : Fortran Subroutines to Compute Improved Incomplete Cholesky Factorizations,''","ACM Trans Mathematical Software v","M Jones"
"133","3","23","P Plassmann","``An Improved Incomplete Cholesky Factorization,''","ACM Trans Mathematical Software v","M Jones"
"134","3","24","P Plassmann","``Unstructured Mesh Computations on Networks of Workstations,''","Computer Aided Civil and Infrastructure Engineering","M Jones"
"135","3","25","P Plassmann, R Gjertsen","Parallel Heuristics for Improved, Balanced Graph Colorings ","J Parallel Distrib Comput","M Jones"
"136","3","26","P Plassmann","``Parallel Algorithms for Adaptive Mesh Refinement,''","SIAM Society for Industrial and Applied Mathematics Journal Scientific Computing v","M Jones"
"137","3","27","P Plassmann","Parallel Solution of Unstructured, Sparse Systems of Linear Equations ","PPSC SIAM Conference Parallel Processing for Scientific Computing","M Jones"
"138","3","28","P Plassmann","Recent Results in the Modeling of Type - II Superconductors on Massively Parallel Computers ","PPSC SIAM Conference Parallel Processing for Scientific Computing","M Jones"
"139","3","29","P Plassmann","Scalable Iterative Solution of Sparse Linear Systems ","Parallel Computing","M Jones"
